{
  "runs": {
    "backfill-20260729-easy-pc-fix-guide": {
      "attempts": 1,
      "last_error": "",
      "last_success_at": "2026-07-29T06:48:26.362200+00:00",
      "pending": false,
      "run_id": "backfill-20260729-easy-pc-fix-guide",
      "status": "SUCCESS",
      "updated_at": "2026-07-29T06:48:26.362200+00:00"
    },
    "backfill-search-console-20260729-easy-pc-fix-guide": {
      "attempts": 1,
      "last_error": "",
      "last_success_at": "2026-07-29T07:07:27.872566+00:00",
      "pending": false,
      "run_id": "backfill-search-console-20260729-easy-pc-fix-guide",
      "status": "SUCCESS",
      "updated_at": "2026-07-29T07:07:27.872566+00:00"
    },
    "backfill_20260729_easy_pc_fix_guide_initial": {
      "attempts": 1,
      "last_error": "",
      "last_success_at": "2026-07-29T06:48:26.636078+00:00",
      "pending": false,
      "run_id": "backfill_20260729_easy_pc_fix_guide_initial",
      "status": "SUCCESS",
      "updated_at": "2026-07-29T06:48:26.636078+00:00"
    },
    "weekly-2026-W31-easy-pc-fix-guide": {
      "attempts": 1,
      "last_error": "",
      "last_success_at": "2026-08-02T11:30:24.491186+00:00",
      "pending": false,
      "run_id": "weekly-2026-W31-easy-pc-fix-guide",
      "status": "SUCCESS",
      "updated_at": "2026-08-02T11:30:24.491186+00:00"
    }
  },
  "schema_version": 1,
  "site": "easy_pc_fix_guide",
  "updated_at": "2026-08-02T11:30:24.491186+00:00"
}
