{
  "runs": {
    "backfill-20260729-korea-easy-guide": {
      "attempts": 1,
      "last_error": "",
      "last_success_at": "2026-07-29T06:48:26.974469+00:00",
      "pending": false,
      "run_id": "backfill-20260729-korea-easy-guide",
      "status": "SUCCESS",
      "updated_at": "2026-07-29T06:48:26.974469+00:00"
    },
    "backfill-search-console-20260729-korea-easy-guide": {
      "attempts": 1,
      "last_error": "",
      "last_success_at": "2026-07-29T07:07:28.153972+00:00",
      "pending": false,
      "run_id": "backfill-search-console-20260729-korea-easy-guide",
      "status": "SUCCESS",
      "updated_at": "2026-07-29T07:07:28.153972+00:00"
    },
    "backfill_20260729_korea_easy_guide_initial": {
      "attempts": 1,
      "last_error": "",
      "last_success_at": "2026-07-29T06:48:27.282227+00:00",
      "pending": false,
      "run_id": "backfill_20260729_korea_easy_guide_initial",
      "status": "SUCCESS",
      "updated_at": "2026-07-29T06:48:27.282227+00:00"
    },
    "weekly-2026-W31-korea-easy-guide": {
      "attempts": 1,
      "last_error": "",
      "last_success_at": "2026-08-02T11:30:24.471246+00:00",
      "pending": false,
      "run_id": "weekly-2026-W31-korea-easy-guide",
      "status": "SUCCESS",
      "updated_at": "2026-08-02T11:30:24.471246+00:00"
    }
  },
  "schema_version": 1,
  "site": "korea_easy_guide",
  "updated_at": "2026-08-02T11:30:24.471246+00:00"
}
